### ISSUE TITLE
TimeOut during bosh deployment 

### ISSUE THREAD

**Issue by giva01121** [genesis-community/genesis#361]
Hello, 
I'm trying to deploy bosh director with the following config:
```
kit:
  name:    bosh
  version: 1.6.2
  features:
    - openstack
    - proto

params:
  env:   ops

  # These properties definte the host-level networking for a proto-BOSH.
  # Environmental BOSHes can depend on their parent BOSH cloud-config,
  # but for proto- environments, we have to specify these.
  #
  static_ip:       192.168.0.15
  subnet_addr:     192.168.0.0/24
  default_gateway: 192.168.0.1
  dns:
    - 8.8.8.8

  # BOSH on Openstack needs to know where the OpenStack API lives,
  # what domain / project to use for deploying VMs, as well as what
  # default security group to apply to all deployed VMs, and what
  # named SSH key governs access to those VMs
  #
  # Openstack credentials are stored in the Vault at
  #   secret/ops/bosh/openstack/creds
  #
  openstack_auth_url: https://somerandomapi:5000/v3
  openstack_region:   RegionOne
  openstack_ssh_key:  genesis3 
  openstack_default_security_groups:
    - cf
    - SSH
    - default
    - ICMP

  # The following configuration is only necessary for proto-BOSH
  # deployments, since environment BOSHes will derive their networking
  # flavor, and availability zones from their parent BOSH cloud-config.
  #
  openstack_network_id: c43a18111-cceb-41dd-9414-736ef8a0ea50
  openstack_flavor:     c1.3
  openstack_az:         dea
```

The bosh deployment is hanging during the execution of `genesis deploy ops` on this step:
```
[httpClient] 2020/01/09 14:46:00 DEBUG - Sending POST request to endpoint 'https://mbus:ThxBOseLiGT7aP3g3AvALpaRxdyGI2X7b54JCa3ZypcVkj0pxgUNbwHrBb9a5q1X@192.168.0.15:6868/agent'
[timeoutRetryStrategy] 2020/01/09 14:46:00 DEBUG - Making attempt
``` 
After I cancel the deployment, I see that the Instance is created, but I can't login to it via `genesis do ops -- login` 
This is the output:
```
Running login addon for ops
[File System] 2020/01/09 14:57:01 DEBUG - Expanding path for '~/.bosh/tmp'
[File System] 2020/01/09 14:57:01 DEBUG - Making dir /home/debian/.bosh/tmp with perm 0777
[File System] 2020/01/09 14:57:01 DEBUG - Expanding path for '~/.bosh/config'
[File System] 2020/01/09 14:57:01 DEBUG - Checking if file exists /home/debian/.bosh/config
[File System] 2020/01/09 14:57:01 DEBUG - Stat '/home/debian/.bosh/config'
[director.Factory] 2020/01/09 14:57:01 DEBUG - Using custom root CAs
[httpClient] 2020/01/09 14:57:01 DEBUG - Sending GET request to endpoint 'https://192.168.0.15:25555/info'
[attemptRetryStrategy] 2020/01/09 14:57:01 DEBUG - Making attempt #0 for *httpclient.RequestRetryable
[clientRetryable] 2020/01/09 14:57:01 DEBUG - [requestID=e1aaa381-e66e-4b5a-4621-641b38d131f5] Requesting (attempt=1): Request{ Method: 'GET', URL: 'https://192.168.0.15:25555/info' }
[attemptRetryStrategy] 2020/01/09 14:57:02 DEBUG - Making attempt #1 for *httpclient.RequestRetryable
[clientRetryable] 2020/01/09 14:57:02 DEBUG - [requestID=e1aaa381-e66e-4b5a-4621-641b38d131f5] Requesting (attempt=2): Request{ Method: 'GET', URL: 'https://192.168.0.15:25555/info' }
[attemptRetryStrategy] 2020/01/09 14:57:02 DEBUG - Making attempt #2 for *httpclient.RequestRetryable
[clientRetryable] 2020/01/09 14:57:02 DEBUG - [requestID=e1aaa381-e66e-4b5a-4621-641b38d131f5] Requesting (attempt=3): Request{ Method: 'GET', URL: 'https://192.168.0.15:25555/info' }
[attemptRetryStrategy] 2020/01/09 14:57:03 DEBUG - Making attempt #3 for *httpclient.RequestRetryable
[clientRetryable] 2020/01/09 14:57:03 DEBUG - [requestID=e1aaa381-e66e-4b5a-4621-641b38d131f5] Requesting (attempt=4): Request{ Method: 'GET', URL: 'https://192.168.0.15:25555/info' }
[attemptRetryStrategy] 2020/01/09 14:57:03 DEBUG - Making attempt #4 for *httpclient.RequestRetryable
[clientRetryable] 2020/01/09 14:57:03 DEBUG - [requestID=e1aaa381-e66e-4b5a-4621-641b38d131f5] Requesting (attempt=5): Request{ Method: 'GET', URL: 'https://192.168.0.15:25555/info' }
[CLI] 2020/01/09 14:57:04 ERROR - Fetching info: Performing request GET 'https://192.168.0.15:25555/info': Performing GET request: Retry: Get https://192.168.0.15:25555/info: dial tcp 192.168.0.15:25555: connec
 connection refused
Fetching info:
  Performing request GET 'https://192.168.0.15:25555/info':
    Performing GET request:
      Retry: Get https://192.168.0.15:25555/info: dial tcp 192.168.0.15:25555: connect: connection refused

```
Any idea how can I resolve this ?

**Comment by jhunt** [comment]
The mbus that was timing out is what the director on your client machine uses to talk to the nascent BOSH director VM, to give its deployment orders.  Cancelling the deployment at that step probably netted you a stock VM on OpenStack, with nothing on it other than a very confused (and lonely) `bosh-agent`.  That's why your `do login` failed -- proto-BOSH never finished deploying.

I would check the networking security in OpenStack and the surrounding infrastructure to see if anything would preventing connection _into_ 192.168.0.15 on TCP/6868 or replies outbound _from_ 192.168.0.15 to ephemeral (>32k) ports.

You could also try running a `tcpdump -Xnvv host 192.168.0.15` in parallel with another attempt to `genesis deploy ops` and see what the network traffic looks like - if you're sending SYN packets (`[S]`) and never getting a SYN/ACK reply (`[S.]`) from the 192.168.0.15 host, that points to a firewall or security group somewhere in between silently dropping your initiating or return-path traffic.

**Comment by giva01121** [comment]
The security group rules for bosh are the following:

![image](https://user-images.githubusercontent.com/58251102/72272334-2200da00-3631-11ea-9eb4-b59cb27f44ba.png)

This is the output of the tcpdump:
```
root@genesis:~# tcpdump -Xnvv host 192.168.15.5
tcpdump: listening on eth0, link-type EN10MB (Ethernet), capture size 262144 bytes
16:16:12.504741 ARP, Ethernet (len 6), IPv4 (len 4), Request who-has 192.168.15.5 (ff:ff:ff:ff:ff:ff) tell 192.168.15.5, length 28
	0x0000:  0001 0800 0604 0001 fa16 3eb2 f928 c0a8  ..........>..(..
	0x0010:  0f05 ffff ffff ffff c0a8 0f05            ............
16:16:12.594754 IP (tos 0x0, ttl 64, id 33457, offset 0, flags [DF], proto TCP (6), length 60)
    192.168.15.14.43350 > 192.168.15.5.6868: Flags [S], cksum 0x9f92 (incorrect -> 0x27a5), seq 1553838876, win 26130, options [mss 8710,sackOK,TS val 4288097046 ecr 0,nop,wscale 7], length 0
	0x0000:  4500 003c 82b1 4000 4006 18a7 c0a8 0f0e  E..<..@.@.......
	0x0010:  c0a8 0f05 a956 1ad4 5c9d b31c 0000 0000  .....V..\.......
	0x0020:  a002 6612 9f92 0000 0204 2206 0402 080a  ..f.......".....
	0x0030:  ff97 2b16 0000 0000 0103 0307            ..+.........
16:16:12.595170 IP (tos 0x0, ttl 64, id 0, offset 0, flags [DF], proto TCP (6), length 40)
    192.168.15.5.6868 > 192.168.15.14.43350: Flags [R.], cksum 0x3c87 (correct), seq 0, ack 1553838877, win 0, length 0
	0x0000:  4500 0028 0000 4000 4006 9b6c c0a8 0f05  E..(..@.@..l....
	0x0010:  c0a8 0f0e 1ad4 a956 0000 0000 5c9d b31d  .......V....\...
	0x0020:  5014 0000 3c87 0000                      P...<...
16:16:13.095988 IP (tos 0x0, ttl 64, id 30565, offset 0, flags [DF], proto TCP (6), length 60)
    192.168.15.14.43352 > 192.168.15.5.6868: Flags [S], cksum 0x9f92 (incorrect -> 0x4a9c), seq 2776384847, win 26130, options [mss 8710,sackOK,TS val 4288097547 ecr 0,nop,wscale 7], length 0
	0x0000:  4500 003c 7765 4000 4006 23f3 c0a8 0f0e  E..<we@.@.#.....
	0x0010:  c0a8 0f05 a958 1ad4 a57c 454f 0000 0000  .....X...|EO....
	0x0020:  a002 6612 9f92 0000 0204 2206 0402 080a  ..f.......".....
	0x0030:  ff97 2d0b 0000 0000 0103 0307            ..-.........
16:16:13.096613 IP (tos 0x0, ttl 64, id 0, offset 0, flags [DF], proto TCP (6), length 40)
    192.168.15.5.6868 > 192.168.15.14.43352: Flags [R.], cksum 0x6173 (correct), seq 0, ack 2776384848, win 0, length 0
	0x0000:  4500 0028 0000 4000 4006 9b6c c0a8 0f05  E..(..@.@..l....
	0x0010:  c0a8 0f0e 1ad4 a958 0000 0000 a57c 4550  .......X.....|EP
	0x0020:  5014 0000 6173 0000                      P...as..
16:16:13.597259 IP (tos 0x0, ttl 64, id 17254, offset 0, flags [DF], proto TCP (6), length 60)
    192.168.15.14.43354 > 192.168.15.5.6868: Flags [S], cksum 0x9f92 (incorrect -> 0xfbf9), seq 3316937153, win 26130, options [mss 8710,sackOK,TS val 4288098049 ecr 0,nop,wscale 7], length 0
	0x0000:  4500 003c 4366 4000 4006 57f2 c0a8 0f0e  E..<Cf@.@.W.....
	0x0010:  c0a8 0f05 a95a 1ad4 c5b4 71c1 0000 0000  .....Z....q.....
	0x0020:  a002 6612 9f92 0000 0204 2206 0402 080a  ..f.......".....
	0x0030:  ff97 2f01 0000 0000 0103 0307            ../.........
16:16:13.597635 IP (tos 0x0, ttl 64, id 0, offset 0, flags [DF], proto TCP (6), length 40)
    192.168.15.5.6868 > 192.168.15.14.43354: Flags [R.], cksum 0x14c7 (correct), seq 0, ack 3316937154, win 0, length 0
	0x0000:  4500 0028 0000 4000 4006 9b6c c0a8 0f05  E..(..@.@..l....
	0x0010:  c0a8 0f0e 1ad4 a95a 0000 0000 c5b4 71c2  .......Z......q.
	0x0020:  5014 0000 14c7 0000                      P.......
16:16:13.659763 ARP, Ethernet (len 6), IPv4 (len 4), Request who-has 192.168.15.5 (ff:ff:ff:ff:ff:ff) tell 192.168.15.5, length 28
	0x0000:  0001 0800 0604 0001 fa16 3eb2 f928 c0a8  ..........>..(..
	0x0010:  0f05 ffff ffff ffff c0a8 0f05            ............
16:16:14.098359 IP (tos 0x0, ttl 64, id 60524, offset 0, flags [DF], proto TCP (6), length 60)
    192.168.15.14.43356 > 192.168.15.5.6868: Flags [S], cksum 0x9f92 (incorrect -> 0x2e44), seq 602660681, win 26130, options [mss 8710,sackOK,TS val 4288098550 ecr 0,nop,wscale 7], length 0
	0x0000:  4500 003c ec6c 4000 4006 aeeb c0a8 0f0e  E..<.l@.@.......
	0x0010:  c0a8 0f05 a95c 1ad4 23eb df49 0000 0000  .....\..#..I....
	0x0020:  a002 6612 9f92 0000 0204 2206 0402 080a  ..f.......".....
	0x0030:  ff97 30f6 0000 0000 0103 0307            ..0.........
16:16:14.098853 IP (tos 0x0, ttl 64, id 0, offset 0, flags [DF], proto TCP (6), length 40)
    192.168.15.5.6868 > 192.168.15.14.43356: Flags [R.], cksum 0x4906 (correct), seq 0, ack 602660682, win 0, length 0
	0x0000:  4500 0028 0000 4000 4006 9b6c c0a8 0f05  E..(..@.@..l....
	0x0010:  c0a8 0f0e 1ad4 a95c 0000 0000 23eb df4a  .......\....#..J
	0x0020:  5014 0000 4906 0000                      P...I...
16:16:14.599923 IP (tos 0x0, ttl 64, id 15798, offset 0, flags [DF], proto TCP (6), length 60)
    192.168.15.14.43358 > 192.168.15.5.6868: Flags [S], cksum 0x9f92 (incorrect -> 0x3412), seq 3982167572, win 26130, options [mss 8710,sackOK,TS val 4288099051 ecr 0,nop,wscale 7], length 0
	0x0000:  4500 003c 3db6 4000 4006 5da2 c0a8 0f0e  E..<=.@.@.].....
	0x0010:  c0a8 0f05 a95e 1ad4 ed5b 0e14 0000 0000  .....^...[......
	0x0020:  a002 6612 9f92 0000 0204 2206 0402 080a  ..f.......".....
	0x0030:  ff97 32eb 0000 0000 0103 0307            ..2.........
16:16:14.600445 IP (tos 0x0, ttl 64, id 0, offset 0, flags [DF], proto TCP (6), length 40)
    192.168.15.5.6868 > 192.168.15.14.43358: Flags [R.], cksum 0x50c9 (correct), seq 0, ack 3982167573, win 0, length 0
	0x0000:  4500 0028 0000 4000 4006 9b6c c0a8 0f05  E..(..@.@..l....
	0x0010:  c0a8 0f0e 1ad4 a95e 0000 0000 ed5b 0e15  .......^.....[..
	0x0020:  5014 0000 50c9 0000                      P...P...
16:16:14.811564 ARP, Ethernet (len 6), IPv4 (len 4), Request who-has 192.168.15.5 (ff:ff:ff:ff:ff:ff) tell 192.168.15.5, length 28
	0x0000:  0001 0800 0604 0001 fa16 3eb2 f928 c0a8  ..........>..(..
	0x0010:  0f05 ffff ffff ffff c0a8 0f05            ............
16:16:15.101042 IP (tos 0x0, ttl 64, id 11870, offset 0, flags [DF], proto TCP (6), length 60)
    192.168.15.14.43360 > 192.168.15.5.6868: Flags [S], cksum 0x9f92 (incorrect -> 0xc07d), seq 1389042241, win 26130, options [mss 8710,sackOK,TS val 4288099553 ecr 0,nop,wscale 7], length 0
	0x0000:  4500 003c 2e5e 4000 4006 6cfa c0a8 0f0e  E..<.^@.@.l.....
	0x0010:  c0a8 0f05 a960 1ad4 52cb 1a41 0000 0000  .....`..R..A....
	0x0020:  a002 6612 9f92 0000 0204 2206 0402 080a  ..f.......".....
	0x0030:  ff97 34e1 0000 0000 0103 0307            ..4.........
16:16:15.101739 IP (tos 0x0, ttl 64, id 0, offset 0, flags [DF], proto TCP (6), length 40)
    192.168.15.5.6868 > 192.168.15.14.43360: Flags [R.], cksum 0xdf2a (correct), seq 0, ack 1389042242, win 0, length 0
	0x0000:  4500 0028 0000 4000 4006 9b6c c0a8 0f05  E..(..@.@..l....
	0x0010:  c0a8 0f0e 1ad4 a960 0000 0000 52cb 1a42  .......`....R..B
	0x0020:  5014 0000 df2a 0000                      P....*..
16:16:15.602436 IP (tos 0x0, ttl 64, id 2271, offset 0, flags [DF], proto TCP (6), length 60)
    192.168.15.14.43362 > 192.168.15.5.6868: Flags [S], cksum 0x9f92 (incorrect -> 0x2c9b), seq 3266657346, win 26130, options [mss 8710,sackOK,TS val 4288100054 ecr 0,nop,wscale 7], length 0
	0x0000:  4500 003c 08df 4000 4006 9279 c0a8 0f0e  E..<..@.@..y....
	0x0010:  c0a8 0f05 a962 1ad4 c2b5 3c42 0000 0000  .....b....<B....
	0x0020:  a002 6612 9f92 0000 0204 2206 0402 080a  ..f.......".....
	0x0030:  ff97 36d6 0000 0000 0103 0307            ..6.........
```

**Comment by jhunt** [comment]
Your initial `SYN` package is immediately responded with an `RST`.

However, the IP addresses in this last update differ from those in the initial report.  At first, you were trying to connect to `192.168.0.15`, but now we see TCP connections attempted from `192.168.15.14` (assuming that's your jumpbox / bastion) to `192.168.15.5` (not `.0.5`).

Did I misunderstand the initial request?  Did the BOSH director move?

**Comment by giva01121** [comment]
@jhunt By the way I've tried the same thing in Azure and it's working. So the issue is that for our OpenStack we need to increase the connection timeout, also there are additional cloud properties which need to be defined(e.g. the image type should be "RAW", we need to enable boot_from_volume option and so on) Is there an option to provide additional config file to the genesis in order to apply these cloud specific properties ?

**Comment by jhunt** [comment]
You can always override any part of the manifest by just specifying your overrides, as a YAML fragment.  Genesis uses `spruce` to merge YAML files together, which often just does what you want it to do.

If you do get a set of changes that work for you, I'd love to review them, either as a PR to the BOSH Kit (https://github.com/genesis-community/bosh-genesis-kit) for the OpenStack features, or just a sanitized copy of your overrides that we can merge back into the mainline ourselves.

Sadly, we lack access to an OpenStack environment these days, so those bits and pieces don't often get enough attention.

**Comment by giva01121** [comment]
@jhunt 
Here I've tried putting additional cloud properties yml, in the folder where "ops.yml" is placed, unfortunately Genesis it's not picking it up. Can I reach you via some online chat maybe ?
Anyway here are the properties which I've added for OpenStack:
```
cloud_provider:
  properties:
    openstack:
      connection_options:
        read_timeout: ((openstack_read_timeout))
      human_readable_vm_names: true
      resource_pools:
- cloud_properties:
    availability_zone: ((az))
    boot_from_volume: true
    instance_type: g1.2
    root_disk:
      size: 20
  env:
    bosh:
      mbus:
        cert: ((mbus_bootstrap_ssl))
      password: '*'
  ephemeral_disk:
    size: 40
  name: vms
  network: default
  stemcell:
    sha1: e1570c8ccf4afae09a0cd6d15b962e9b920f564a
    url: https://s3.amazonaws.com/bosh-core-stemcells/315.13/bosh-stemcell-315.13-openstack-kvm-ubuntu-xenial-go_agent-raw.tgz

```

**Comment by jhunt** [comment]
The overrides need to go in the same file that defines the `kit:` and `params:` top-level keys.  My guess is that you'll need to set the cloud overrides on the instance group level `properties:` key.

If you want to chat, come find us in the Genesis Project slack org: https://genesisproject.io/community/#slack
